{
  "$schema": "https://json-schema.org/draft/2020-12/schema",
  "$id": "https://nextjshx.dev/schemas/config-v2.json",
  "title": "NextJsHx project configuration",
  "type": "object",
  "additionalProperties": false,
  "required": [
    "schemaVersion",
    "haxe",
    "next",
    "output"
  ],
  "properties": {
    "$schema": {
      "const": "https://nextjshx.dev/schemas/config-v2.json"
    },
    "schemaVersion": {
      "const": 2
    },
    "appRoot": {
      "$ref": "#/$defs/projectPath"
    },
    "boundaries": {
      "type": "object",
      "additionalProperties": false,
      "properties": {
        "maxDirectDependencies": {
          "type": "integer",
          "minimum": 0
        },
        "maxObservedClientBytes": {
          "type": "integer",
          "minimum": 0
        }
      }
    },
    "haxe": {
      "type": "object",
      "additionalProperties": false,
      "required": [
        "generatedRoot",
        "sourceRoots"
      ],
      "properties": {
        "generatedRoot": {
          "$ref": "#/$defs/projectPath"
        },
        "sourceRoots": {
          "type": "array",
          "minItems": 1,
          "uniqueItems": true,
          "items": {
            "$ref": "#/$defs/externalRelativePath"
          }
        },
        "extraInputs": {
          "type": "array",
          "default": [],
          "uniqueItems": true,
          "items": {
            "$ref": "#/$defs/projectPath"
          }
        }
      }
    },
    "next": {
      "type": "object",
      "additionalProperties": false,
      "required": [
        "package",
        "typedRoutes"
      ],
      "properties": {
        "package": {
          "type": "string",
          "pattern": "^(?:@[a-z0-9][a-z0-9._~-]*/)?[a-z0-9][a-z0-9._~-]*$"
        },
        "upstreamDir": {
          "$ref": "#/$defs/externalRelativePath"
        },
        "typedRoutes": {
          "type": "boolean"
        },
        "cacheComponents": {
          "type": "boolean",
          "default": false
        },
        "experimentalCacheDirectives": {
          "type": "array",
          "default": [],
          "uniqueItems": true,
          "items": {
            "enum": [
              "private",
              "remote"
            ]
          }
        }
      },
      "allOf": [
        {
          "if": {
            "properties": {
              "cacheComponents": {
                "const": false
              }
            },
            "required": [
              "cacheComponents"
            ]
          },
          "then": {
            "properties": {
              "experimentalCacheDirectives": {
                "type": "array",
                "maxItems": 0
              }
            }
          }
        },
        {
          "if": {
            "not": {
              "required": [
                "cacheComponents"
              ]
            }
          },
          "then": {
            "properties": {
              "experimentalCacheDirectives": {
                "type": "array",
                "maxItems": 0
              }
            }
          }
        }
      ]
    },
    "output": {
      "type": "object",
      "additionalProperties": false,
      "required": [
        "manifest",
        "format",
        "language",
        "intent",
        "profileVersion",
        "sourceMaps",
        "sourcesContent",
        "declarations",
        "jsxRuntime"
      ],
      "properties": {
        "manifest": {
          "allOf": [
            {
              "$ref": "#/$defs/projectPath"
            },
            {
              "type": "string",
              "pattern": "^\\.nextjshx/(?!(?:transaction\\.json$|transactions/|plans/)).+\\.json$"
            }
          ]
        },
        "format": {
          "const": "project"
        },
        "language": {
          "enum": [
            "typescript",
            "javascript"
          ]
        },
        "intent": {
          "enum": [
            "reviewable",
            "optimized"
          ]
        },
        "profileVersion": {
          "const": 1
        },
        "sourceMaps": {
          "enum": [
            "external",
            "inline",
            "none"
          ]
        },
        "sourcesContent": {
          "type": "boolean"
        },
        "declarations": {
          "enum": [
            "public",
            "all",
            "none"
          ]
        },
        "jsxRuntime": {
          "enum": [
            "automatic",
            "classic"
          ]
        }
      }
    }
  },
  "$defs": {
    "nonEmptyString": {
      "type": "string",
      "minLength": 1,
      "pattern": "\\S"
    },
    "projectPath": {
      "type": "string",
      "minLength": 1,
      "pattern": "^(?!/)(?![A-Za-z]:)(?!.*\\\\)(?!.*(?:^|/)\\.\\.?(?:/|$))(?!.*//).+$"
    },
    "externalRelativePath": {
      "type": "string",
      "minLength": 1,
      "pattern": "^(?!/)(?![A-Za-z]:)(?!.*\\\\)(?!.*(?:^|/)\\.(?:/|$))(?!.*//).+$"
    }
  }
}
